[
  {
    "id": "presence_patrols",
    "name": "Presence Patrols",
    "family": "military",
    "target": "node",
    "mandate_cost": 2,
    "treasury_cost": 2,
    "effects": [
      { "op": "ops_pressure", "amount": 25, "turns": 3 }
    ],
    "casualty_risk": 0.3,
    "backfire": {
      "channel": "occupation_antibodies",
      "probability": 0.15,
      "effects": [
        { "op": "local_legitimacy", "delta": -2 },
        { "op": "grievance", "delta": 2 }
      ],
      "note": "Foreign boots past the welcome threshold generate antibodies (Kilcullen). Casualty drip handled via casualty_risk → Domestic."
    },
    "notes": "Suppresses Strength and raises insurgent Visibility while active.",
    "sources": ["FM 3-24 paradoxes", "Kilcullen, The Accidental Guerrilla"]
  },
  {
    "id": "partnered_raids",
    "name": "Partnered Raids",
    "family": "military",
    "target": "node",
    "mandate_cost": 1,
    "treasury_cost": 1,
    "effects": [
      { "op": "attrit", "amount": 8 },
      { "op": "partner_capacity", "delta": 2 }
    ],
    "casualty_risk": 0.1,
    "backfire": {
      "channel": "partner_conduct",
      "probability": 0.2,
      "effects": [
        { "op": "local_legitimacy", "delta": -4 },
        { "op": "international_legitimacy", "delta": -3 },
        { "op": "grievance", "delta": 4 }
      ],
      "note": "Cheap attrition, but partner-force abuses carry your flag — Local and International pay for it."
    },
    "sources": ["FM 3-24", "Sahel partner-force abuse reporting"]
  },
  {
    "id": "drone_strike",
    "name": "Drone Strike",
    "family": "military",
    "target": "node",
    "mandate_cost": 1,
    "treasury_cost": 2,
    "effects": [
      { "op": "attrit", "amount": 12 }
    ],
    "backfire": {
      "channel": "collateral",
      "probability": 0.25,
      "effects": [
        { "op": "local_legitimacy", "delta": -5 },
        { "op": "grievance", "delta": 6 },
        { "op": "international_legitimacy", "delta": -2 }
      ],
      "note": "Fast and no body bags — until the collateral roll: a crater, a martyrdom narrative, a recruitment spike via Grievance."
    },
    "sources": ["RAND on decapitation limits", "FM 3-24 paradoxes"]
  },
  {
    "id": "train_equip",
    "name": "Train & Equip",
    "family": "military",
    "target": "node",
    "mandate_cost": 2,
    "treasury_cost": 3,
    "effects": [
      { "op": "partner_capacity", "delta": 5 }
    ],
    "backfire": {
      "channel": "coup_seed",
      "probability": 1.0,
      "effects": [
        { "op": "coup_seed", "delta": 0.2 }
      ],
      "note": "Cheap force multiplier — and every cycle plants a coup seed: trained officers raise junta odds on the collapse roll (several Sahel coup leaders were Western-trained). Arms leakage to the graph lands v0.4."
    },
    "sources": ["Sahel coup-leader training records"]
  },
  {
    "id": "development_program",
    "name": "Development Program",
    "family": "governance",
    "target": "node",
    "mandate_cost": 2,
    "treasury_cost": 3,
    "effects": [
      { "op": "development", "delta": 3 },
      { "op": "local_legitimacy", "delta": 3 },
      { "op": "governance", "delta": 2 },
      { "op": "grievance", "delta": -2 }
    ],
    "backfire": {
      "channel": "insurgent_taxation",
      "probability": 0.3,
      "effects": [
        { "op": "attrit", "amount": -2 }
      ],
      "note": "Wells, roads, schools — slow Local gains; in contested regions the shadow government taxes the project and the insurgency profits from your aid (negative attrit = strength gain)."
    },
    "sources": ["Galula — the 80% political rule"]
  },
  {
    "id": "amnesty_reintegration",
    "name": "Amnesty & Reintegration",
    "family": "governance",
    "target": "node",
    "mandate_cost": 2,
    "treasury_cost": 3,
    "effects": [
      { "op": "amnesty", "rate": 0.06, "turns": 4 },
      { "op": "domestic_legitimacy", "delta": -3 }
    ],
    "backfire": {
      "channel": "recidivism",
      "probability": 0.2,
      "effects": [
        { "op": "attrit", "amount": -3 }
      ],
      "note": "Drains Strength via Defection and costs you 'soft on terror' at home up front; if security lapses, reintegrated fighters return to the fight."
    },
    "sources": ["RAND, How Insurgencies End — negotiated drawdowns"]
  },
  {
    "id": "humint_network",
    "name": "HUMINT Network",
    "family": "intelligence",
    "target": "node",
    "mandate_cost": 1,
    "treasury_cost": 2,
    "effects": [
      { "op": "intel", "delta": 0.25, "turns": 6 }
    ],
    "backfire": {
      "channel": "blown_agent",
      "probability": 0.1,
      "effects": [
        { "op": "local_legitimacy", "delta": -2 },
        { "op": "international_legitimacy", "delta": -1 }
      ],
      "note": "The only counter to deceptive calm — it reveals Entrenchment truth. A blown network burns the people who trusted you."
    },
    "sources": ["DESIGN §9 — fog and deceptive calm"]
  },
  {
    "id": "un_mandate",
    "name": "Seek UN Mandate",
    "family": "diplomatic",
    "target": "global",
    "mandate_cost": 2,
    "treasury_cost": 1,
    "effects": [
      { "op": "intl_umbrella", "delta": 1, "turns": 8 },
      { "op": "international_legitimacy", "delta": 3 }
    ],
    "backfire": {
      "channel": "veto_delay",
      "probability": 0.3,
      "effects": [
        { "op": "international_legitimacy", "delta": -2 },
        { "op": "domestic_legitimacy", "delta": -1 }
      ],
      "note": "A cheap legitimacy umbrella that is slow and vetoable — a stalled resolution reads as weakness at home and abroad."
    },
    "sources": ["MINUSMA record"]
  },
  {
    "id": "fund_research",
    "name": "Fund Independent Research",
    "family": "diplomatic",
    "target": "node",
    "mandate_cost": 1,
    "treasury_cost": 3,
    "effects": [
      { "op": "exposure", "delta": 6 }
    ],
    "backfire": {
      "channel": "funders_paradox",
      "probability": 0.2,
      "effects": [
        { "op": "international_legitimacy", "delta": -2 },
        { "op": "domestic_legitimacy", "delta": -1 }
      ],
      "note": "Endow think tanks and academics to document a regime — slow, durable Exposure that raises the price of its no-strings patron. But state money is an attack surface: 'foreign puppet' discrediting can blunt the very credibility you bought (the OCCRP funding paradox)."
    },
    "notes": "The empirical backbone of the §20 Exposure system: research that survives denial.",
    "sources": ["Global Witness / The Sentry → Magnitsky designation pipeline", "OCCRP funding-independence FAQ"]
  },
  {
    "id": "support_exile_media",
    "name": "Support Exile Media",
    "family": "intelligence",
    "target": "node",
    "mandate_cost": 1,
    "treasury_cost": 2,
    "effects": [
      { "op": "exposure", "delta": 10 }
    ],
    "backfire": {
      "channel": "transnational_repression",
      "probability": 0.25,
      "effects": [
        { "op": "international_legitimacy", "delta": -1 },
        { "op": "local_legitimacy", "delta": -2 }
      ],
      "note": "Exile journalists move faster than think tanks — but the regime reaches their families and local fixers (transnational repression, Pegasus). The human cost is real, and the game does not flinch from it."
    },
    "notes": "Faster Exposure, carried by people the regime can hurt (§20.4).",
    "sources": ["Freedom House, Transnational Repression", "Forbidden Stories / Amnesty — Pegasus Project"]
  },
  {
    "id": "targeted_sanctions",
    "name": "Targeted Designations",
    "family": "diplomatic",
    "target": "node",
    "mandate_cost": 2,
    "treasury_cost": 1,
    "effects": [
      { "op": "designate" }
    ],
    "backfire": {
      "channel": "patron_retaliation",
      "probability": 0.3,
      "effects": [
        { "op": "partner_capacity", "delta": -2 }
      ],
      "note": "Spend accumulated Exposure to sanction regime figures: strips patron influence and rolls back a bloc's consolidation. Needs the evidence first — a thin case (low Exposure) is dismissed and costs you credibility. The regime retaliates by expelling your people and NGOs."
    },
    "notes": "Converts Exposure into pressure — the documented research→designation chain (§20.4).",
    "sources": ["US Treasury OFAC — Wagner/Mali designations 2023", "Human Rights First — Global Magnitsky dossiers"]
  },
  {
    "id": "negotiate_settlement",
    "name": "Negotiate a Settlement",
    "family": "diplomatic",
    "target": "node",
    "mandate_cost": 2,
    "treasury_cost": 1,
    "effects": [
      { "op": "negotiate" }
    ],
    "backfire": {
      "channel": "spoiler_attack",
      "probability": 0.25,
      "effects": [
        { "op": "grievance", "delta": 3 }
      ],
      "note": "The Rebel Inc endgame: where a faction is stalemated — too strong to crush, not strong enough to win — talks can settle it, draining its Forces and shadow control. Costs you 'soft on terror' at home, earns International respect, and is often the only clean exit. Spoilers may attack the table to break it."
    },
    "notes": "The negotiation endgame (§7 diplomatic). Only bites at genuine stalemate.",
    "sources": ["RAND, How Insurgencies End — negotiated settlements", "Colombia/Havana accords model"]
  },
  {
    "id": "surveillance_expansion",
    "name": "Surveillance Expansion (Emergency Powers I)",
    "family": "domestic",
    "target": "global",
    "mandate_cost": 1,
    "treasury_cost": 1,
    "effects": [
      { "op": "drift", "tiers": 1 },
      { "op": "intel", "delta": 0.1, "turns": 8 }
    ],
    "backfire": {
      "channel": "civil_liberties_scandal",
      "probability": 0.15,
      "effects": [
        { "op": "domestic_legitimacy", "delta": -5 },
        { "op": "international_legitimacy", "delta": -2 }
      ],